date,restaurant,dish,category,reviewer,rating,comment,lat,long,address,link4/19/20,Bacio Pizzeria,Common Good,Italian,Zander,10,Best pizza in DC!,38.91495,-77.0117,"81 Seaton Pl NW, Washington, DC 20001",http://www.baciopizzeria.com/4/11/20,Bacio Pizzeria,Bloomingdale,Italian,Zander,8,,38.91495,-77.0117,"81 Seaton Pl NW, Washington, DC 20001",http://www.baciopizzeria.com/4/12/20,Salt and Pepper Grill,Chick Biryani,Indian,Zander,8,,38.92502,-77.0229,"2632 Georgia Ave NW Washington, DC 20001",https://www.saltandpeppergrill.com/3/21/20,Salt and Pepper Grill,Lamb Korma,Indian,Zander,10,,38.92502,-77.0229,"2632 Georgia Ave NW Washington, DC 20001",https://www.saltandpeppergrill.com/3/27/20,El Chucho,Al Pastor Burrito,Mexican,Zander,9,"Amazing food as always, just on the small side.",38.93108,-77.02788,"3313 11th St NW, Washington, DC 20010",https://www.elchuchodc.com/4/16/20,Chercher,Delux Vegan Special,Ethiopian,Zander,8,,38.908379,-77.02417,"1334 9th St NW, Washington, DC 20001",https://www.chercherrestaurant.com/4/16/20,Chercher,Lega Beef Tibs (mild),Ethiopian,Zander,8,,38.908379,-77.02417,"1334 9th St NW, Washington, DC 20001",https://www.chercherrestaurant.com/